{
  "schemaVersion": 2,
  "id": "example-file-json",
  "command": ["pwsh", "-NoLogo", "-NoProfile", "-File", "C:\\watchers\\file-json.ps1"],
  "intervalSeconds": 60,
  "timeoutSeconds": 30,
  "backendProfile": "YOUR-PROFILE",
  "sender": "service:watcher/examples",
  "target": "project:example/inbox",
  "parameters": { "path": "C:\\watchers\\status.json" }
}
